{
  "$schema": "https://json-schema.org/draft/2020-12/schema",
  "$id": "legal-document.schema.json",
  "title": "LegalDocument",
  "description": "A versioned Vietnamese legal or administrative instrument with full temporal and relationship metadata.",
  "type": "object",
  "_required_note": "document_number, issuing_authority and issue_date were required until ADR-0004. They are not universally knowable from source: issue_date is absent on records discovered via listing pages but never fetched, document_number on records whose page title carries no parseable number, and issuing_authority is only derivable as a raw code (see issuing_authority_code). Requiring them truncated the corpus rather than improving it.",
  "required": [
    "canonical_id",
    "title",
    "document_type",
    "jurisdiction",
    "status",
    "language",
    "official_url",
    "provenance"
  ],
  "additionalProperties": false,
  "properties": {
    "canonical_id": {
      "type": "string",
      "pattern": "^vnkc:legal-doc:[a-z0-9]+(-[a-z0-9]+)*$",
      "description": "VNKC canonical identifier, e.g. vnkc:legal-doc:luat-dat-dai-2024."
    },
    "document_number": { "type": "string", "description": "Official number, e.g. 45/2024/QH15." },
    "title": { "type": "string", "description": "Original Vietnamese title." },
    "title_en": { "type": "string", "description": "English translation, metadata only." },
    "document_type": {
      "type": "string",
      "enum": [
        "constitution",
        "code",
        "law",
        "ordinance",
        "resolution",
        "decree",
        "decision",
        "circular",
        "joint-circular",
        "directive",
        "official-dispatch",
        "treaty",
        "consolidated-document",
        "promulgation-order",
        "historic-ordinance",
        "other"
      ],
      "description": "Canonical English vocabulary. schema.prisma mirrors these as Vietnamese slugs (circular=thong_tu, decree=nghi_dinh, consolidated-document=van_ban_hop_nhat, ...); this list is authoritative per ADR-0002."
    },
    "document_type_basis": {
      "type": "string",
      "enum": ["title_prefix", "number_suffix", "fallback"],
      "description": "How document_type was derived. The Vietnamese title prefix names the type; the number suffix names the issuing body. Orthogonal signals, so the prefix is authoritative."
    },
    "document_number_raw": {
      "type": "string",
      "description": "Unparsed number token, kept when it failed validation rather than guessed at (e.g. 'số', 'TC/QÐ/TCCB')."
    },
    "issuing_authority_code": {
      "type": "string",
      "description": "Verbatim body token from the document number, e.g. 'TT-BYT'. Not resolved to a display name: 1,106 distinct tokens exist and the 30 most common cover only 80% of records."
    },
    "subject_slug": {
      "type": "string",
      "description": "The document's topic, de-diacriticized, from the source URL. `title` on this corpus is a citation ('Thông tư 28/2026/TT-BYT của Bộ Y tế') and carries no subject matter."
    },
    "fetch_status": {
      "type": "string",
      "enum": ["fetched", "discovered"],
      "description": "'discovered' = found on a listing page but the detail page was never retrieved; such records have a title but no dates and no body."
    },
    "issuing_authority": { "type": "string" },
    "jurisdiction": { "type": "string", "description": "e.g. 'national' or 'province:<name>'." },
    "issue_date": {
      "type": "string",
      "format": "date",
      "description": "Date of promulgation (ngày ban hành)."
    },
    "publication_date": {
      "type": ["string", "null"],
      "format": "date",
      "description": "Official Gazette publication date."
    },
    "effective_from": {
      "type": ["string", "null"],
      "format": "date",
      "description": "Ngày hiệu lực."
    },
    "effective_to": {
      "type": ["string", "null"],
      "format": "date",
      "description": "Expiry/repeal date; null while in force."
    },
    "status": {
      "type": "string",
      "enum": [
        "in-force",
        "not-yet-in-force",
        "partially-effective",
        "amended",
        "repealed",
        "expired",
        "unknown"
      ]
    },
    "language": { "type": "string", "enum": ["vi", "en", "vi+en"] },
    "official_url": { "type": "string", "format": "uri" },
    "attachment_urls": { "type": "array", "items": { "type": "string", "format": "uri" } },
    "retrieved_at": { "type": "string", "format": "date-time" },
    "content_checksum": { "type": "string", "pattern": "^sha256:[0-9a-f]{64}$" },
    "version": {
      "type": "integer",
      "minimum": 1,
      "description": "VNKC record version; increments on every change, never overwrites."
    },
    "legal_basis": {
      "type": "array",
      "items": { "type": "string" },
      "description": "Citations of instruments this one is based on (căn cứ)."
    },
    "related_documents": {
      "type": "array",
      "items": { "type": "string" },
      "description": "Canonical IDs."
    },
    "amends": {
      "type": "array",
      "items": { "type": "string" },
      "description": "Canonical IDs this document amends."
    },
    "amended_by": { "type": "array", "items": { "type": "string" } },
    "replaces": { "type": "array", "items": { "type": "string" } },
    "replaced_by": { "type": "array", "items": { "type": "string" } },
    "repeals": { "type": "array", "items": { "type": "string" } },
    "repealed_by": { "type": "array", "items": { "type": "string" } },
    "guides": {
      "type": "array",
      "items": { "type": "string" },
      "description": "Canonical IDs of instruments this one guides the implementation of (hướng dẫn thi hành)."
    },
    "validity_confidence": { "type": "string", "enum": ["verified", "partial", "unverified"] },
    "provenance": { "$ref": "provenance.schema.json" }
  }
}
