{
  "canonical_id": "vnkc:legal-doc:luat-dat-dai-2024",
  "document_number": "45/2024/QH15",
  "title": "Luật Đất đai",
  "title_en": "Land Law 2024",
  "document_type": "law",
  "issuing_authority": "Quốc hội nước Cộng hòa xã hội chủ nghĩa Việt Nam, khóa XV",
  "jurisdiction": "national",
  "issue_date": "2024-01-18",
  "publication_date": null,
  "effective_from": "2024-08-01",
  "effective_to": null,
  "status": "in-force",
  "language": "vi",
  "official_url": "https://vbpl.vn/",
  "attachment_urls": [],
  "retrieved_at": "2026-07-27T00:00:00Z",
  "version": 1,
  "legal_basis": ["Hiến pháp nước Cộng hòa xã hội chủ nghĩa Việt Nam"],
  "related_documents": [],
  "amends": [],
  "amended_by": [],
  "replaces": ["45/2013/QH13"],
  "replaced_by": [],
  "repeals": [],
  "repealed_by": [],
  "guides": [],
  "validity_confidence": "partial",
  "provenance": {
    "source_id": "moj-vbpl",
    "source_url": "https://vbpl.vn/",
    "retrieved_at": "2026-07-27T00:00:00Z",
    "retrieval_method": "manual",
    "license_status": "reference-only",
    "attribution": "Bộ Tư pháp nước CHXHCN Việt Nam — vbpl.vn",
    "confidence": "partial",
    "notes": "Phase 0 hand-curated example. Metadata (number, dates, replaces) from public records; the per-document vbpl.vn URL and Gazette publication date are recorded at ingest time, not hand-typed. effective_from reflects Luật 43/2024/QH15 moving the date earlier from 2025-01-01 to 2024-08-01 — validity_confidence downgraded to partial pending citation-level verification."
  }
}
